{
  "profile": "editorial-responsibility",
  "profile_version": "0.1",
  "check_set_version": "0.1",
  "item": {
    "item_id": "community-resilience-update-2026-08",
    "item_title": "Community Resilience Update",
    "publication_context": "Harbour Community Brief / Public updates",
    "published_artifact": "artifacts/published-item.txt",
    "content_hash": "a017a6b8f0e1ec8636dd5dead44051a1e53b49e62f346ec3b1ea5e8496b3f408",
    "published_at": "2026-08-02T09:00:00Z"
  },
  "generation_events": [
    {
      "system_id": "research-agent",
      "system_name": "Research Agent",
      "model": "producer-supplied",
      "model_version": "unknown",
      "occurred_at": "2026-08-02T08:05:00Z"
    }
  ],
  "review_events": [
    {
      "reviewer_id": "editor-01",
      "reviewer_display_name": "Maya Chen",
      "review_type": "substantive",
      "scope_reviewed": "whole item",
      "changes_made": true,
      "post_review_content_hash": "a017a6b8f0e1ec8636dd5dead44051a1e53b49e62f346ec3b1ea5e8496b3f408",
      "occurred_at": "2026-08-02T08:30:00Z",
      "competence_basis": "Managing editor with responsibility for public-interest reporting",
      "identity_binding": "self_asserted"
    }
  ],
  "editorial_responsibility": {
    "person_or_entity": "Maya Chen, Managing Editor",
    "identifier": "editor-01",
    "declared_at": "2026-08-02T08:45:00Z"
  },
  "disclosure_state": "unknown"
}
